{
  "version": 1,
  "updatedAt": "2026-09-12T12:00:00Z",
  "categories": [
    { "id": "sleep-sounds", "title": "Sleep Sounds", "sortOrder": 0 },
    { "id": "sleep-stories", "title": "Sleep Stories", "sortOrder": 1 },
    { "id": "nature", "title": "Nature", "sortOrder": 2 }
  ],
  "podcasts": [
    {
      "id": "sleepy-noises",
      "feedUrl": "https://feeds.megaphone.fm/REPLACE-WITH-SLEEPY-NOISES-FEED-ID",
      "categoryId": "sleep-sounds",
      "featured": true
    },
    {
      "id": "sleepy-white-noise",
      "feedUrl": "https://feeds.megaphone.fm/REPLACE-WITH-SLEEPY-WHITE-NOISE-FEED-ID",
      "categoryId": "sleep-sounds"
    },
    {
      "id": "sleepy-stories",
      "feedUrl": "https://feeds.megaphone.fm/REPLACE-WITH-SLEEPY-STORIES-FEED-ID",
      "categoryId": "sleep-stories"
    },
    {
      "id": "terrified",
      "feedUrl": "https://feeds.megaphone.fm/REPLACE-WITH-TERRIFIED-FEED-ID",
      "categoryId": "sleep-stories",
      "title": "Terrified - Horror Bedtime Stories"
    },
    {
      "id": "sleepy-nature",
      "feedUrl": "https://feeds.megaphone.fm/REPLACE-WITH-SLEEPY-NATURE-FEED-ID",
      "categoryId": "nature"
    }
  ]
}
